rating,headline,text,would_recommend
5,Few compromises,Got it and currently testing this. Can’t beat price to performance. Max wattage is 115. Capped at 240Hz plugged or unplugged. Screen is glossy which I’m not a big fan of but man do the colors look good. It’s thinner than my previous laptop. I keep my laptops plugged so the battery life is not an issue for me.,Yes
5,So far I loved it,"So far, this is an excellent Laptop. The price is almost the same as other products of the same specifications has. Immediately I put my Steam account and downloaded my favorite games, I was shock whit the quality in the graphics and the jump from my previous PC in comparation when I played, no lag, more fast loading and incredible I began to put all at fantastic. The only thing I think is not good is that of course it is more powerful and heat up more quickly and the fan at max level is loud. In my case I live in Florida so it is very hot outside so I do not recommend using it outdoors.",Yes
4,Great specs,"On paper the specs for the price is fantastic, beautiful OLED screen and 12gb 5070Ti along with a sufficient 32gb ram for under $2k is great. It's much slimmer and lighter than the non-S Neo16, both the laptop itself and the power brick. 

Downsides: refresh rate of the monitor is locked at 240 Hz so power consumption even doing web browsing or word processing type tasks is poor. Really wish they would give the option or automatically toggle to 60hz while on the igpu. Secondly, the power brick connections are bad. I went through 2 Helio Neos both with the same issue. At least the connector on the back of the Slim version clicks in more securely than the non-slim version. But both were touchy and would require unplug/replug at least half the time I turn on the laptop. I think with how great the specs are, Acer couldn't cut costs on things like the GPU or processor, so unquantifiable things like the charging cord is where they found ways to cut costs, unfortunately. Hopefully even with the annoyance of unplugging and replugging and making sure not to touch the power cord, it'll keep working as long as expected.

Temperatures aren't bad, I stay under 75°C while gaming even without a fan dock.",Yes
5,Absolutely no regrets,"Bought this for my son for school and gaming (mostly gaming, not going to lie, but he does do his homework on it) and I am extremely jealous. The graphics and processing speed and insane. This powerhouse of a laptop is an absolute workhorse and can play any game. It is worth the price tag.",Yes
5,Pretty good.,Fairly powerful. Bought at a discount. Slim. Good display. May run hot.,Yes
5,This thing rips!,"The Bees Kneez. Nothing else comes close to the price. The performance for a laptop is insane. The fans are loud, but they keep this thing extremely cool for a gaming laptop with this much power. At first listen, the speakers are absolute K9 excrement, but once i turn of the sound effects and equalizers and used them plainly, they were ok, still the worst performing component.",Yes
5,Great machine,"The hardware works great, there was minimal bloatware that I was able to uninstall easily, still plays decent when not plugged in. While plugged in it plays very well and keeps itself cool without being too loud even if displaying to a 4K TV",Yes
5,"OLED stunning, 5070TI impressive","Shockingly sharp display I though 1440p on a 16"" would be overkill but perhaps combined with OLED it really mesmerized me.  Long time fan of 1080p I was worried the extra pixels would hurt performance but the 5070TI is letting me max out all settings no issues.  I only wish it came with a 2TB drive instead of 1TB but not storing lots of movies it seems fine.",Yes
5,Love It!!,"This is an awesome laptop.  The look and feel of the outside, the buttons, the OLED screen.  The performance of the GPU, frame rates and resolution is outstanding.  My first gaming laptop coming from XBOX series X.  Purchased so I can game outside of just my house.",Yes
4,Acer Predator Helios Neos 16s,Good laptop overall. I was between the legion 7i and this one. I got the acer just because it had better specs. Yes it has some problems like not being able to change the Hz and overheating sometime but I think it’s worth it for the price.,Yes
5,First gaming laptop and I’m obsessed,"Runs so smooth,  colors are so vibrant and all of my games run so well.  The design is super cool and sleek I also love the charging port placement in the back so wherever you choose to set up you won’t have any problems with the cord.",Yes
5,Worth it,So far this laptop has been a beast.  It has handled anything I’ve thrown at it so far with no issues and being able to adjust the fan speed makes it a breeze to keep cool.  The battery life is the only Achilles heel of this product but what do you expect with this much performance jam packed into a small product.,Yes
5,Outstanding gamer laptop,"Very thinn and fast computer. Waited for long time to be available in stock. GREAT EQUIPMENT, several games installed - screen is abosolutely high definition. I can run fortnite with 1980 X 1080 with 250 FPS. with 2550 at 144 FPS. COD and other games have ridiculous high FPS rates. buy it! You can control the laptop bevahiour using the predator sense APP, so i changed easly from working mode to gamer mode (turbo).",Yes
5,Great Performance,"This pc is a beast. As it can be seen from its specs, it has a really high performance. However, it can be out of charge quickly when compared to other alternatives such as a macbook. Other than that  I couldn@t have asked for a better computer.",Yes
5,Greay gaming laptop,"Screen looks amazing. So far im playing Diablo 4, Monster Hunter Wilds, Helldivers 2 and Marvel's Rivals and they run smooth with over 150FPS on max settings. Be sure to put brightnes to max level and play with the settings to take advantage of the OLED display.
Performance mode is ok and turbo mode is kind of loud. But the speakers make up for it. Pretty great laptop specially for the price.",Yes
3,"Performance King, Quality Control Gamble","Performance wise this thing is a beast. Unfortunately, there is a bit of a lottery. I was having significant overheating issues. There were times my CPU hits 70C-80C watching YouTube videos which is not normal. Fortunately for me I am able to open a laptop pretty comfortably and diagnose. The liquid metal from the factory was pretty much non-existent. I had to add a couple drops and re-applicate. If you know what you're doing, this laptop is definitely for you. But if you're expecting to just plug it in without any issues, you may want to reconsider.",Yes
4,Good laptop,Good performance gets a little hot on the bottom of the computer,Yes
4,Great computer,"It’s a great computer. The only things I would comment negatively on is the built in speakers, they don’t have the greatest quality that I feel a computer for this price should have. The fans can be a bit loud, but that’s typical for gaming computers. The screen is beautiful!",Yes
4,Acer predator,"Its a nice laptop, graphics is good but one thing i hate is it heat up so fast.",No
5,Was cautious but very pleased. Solid!,"Was nervous about quality for this price but this laptop is fantastic.  Great build quality.  Mine sits on a cooling bad so the laptop fans never really turn on.  The cooling design of open grates on the bottom works super well.  This laptop does not get hot like previous i7-14 and under series.
It's better than I expected.",Yes
5,great cost-benefit,"Excellent equipment, great value for money.
It's relatively noisy, but the quality is very good. I'm from Brazil, I bought it on a trip, and the price was much better than buying it in my country.",Yes
5,Exceptional Computer and Great Service,"The laptop runs my games perfectly!!  My sales person, Cody, did an amazing job on recognising my needs for a quality but not top shelf laptop.  He searched for a couple minutes to find the correct laptop as a few had the same SKU but not the same specs.  This laptop runs Doom The Dark Ages no problems.  Diablo 4 looks even better than it did on my Windows 10 PC.  Only downfall, which comes with any store bought PC, is all the extra crap the MFG puts on.  Acer software, demo software of McAffee.  I'd rather have that stripped off and let me do what I want...",Yes
5,Great in Windows AND Linux.,"Excellent value especially at the sales price. Nothing comes close to the spec for the money you spend.

This laptop isn’t “fancy”, or even “sleek”. It’s a throwback to big beastly gaming laptops, with a focus on retaining some semblance of thin-ness.

I am using this as a dev workstation, so it’s now running Ubuntu. If you go this route, there will be challenges, for example I still can’t change the rgb for the keyboard. Obviously not the laptops fault, everything is flawless in the default windows install.

I am running LLM’s up to ~14b at ~45 t/s, and creating agents using much lighter models to perform simple tasks. Those run in the hundreds of t/s.",Yes
5,BUY IT! ...before it sells out!,"I have a 17-year-old grandson who can run circles around anyone when it comes to technology. Well, I asked him a couple weeks ago what he might like for Christmas this year and he said he had been researching laptops for weeks, trying to find the one that would support everything he does. Between school and his job, he needs the absolute best and had been saving his money to get this one because ""it’s light years better than everything else!” So, of course I bought it. He is beyond happy with the results. He said it has exceeded his wildest expectations!  Yay Grandma!",Yes
2,Amazing but…,"On paper this Laptop is amazing! Best Buy did an awesome job by listing this product. It was sold out everywhere. I was extremely lucky they had one on display at the best buy near me and so I was able to order one at the store, even though it was sold out. The screen is spectacular. It’s been only a week and the laptop is already shutting down 45 min into my gaming sessions. I purchased the laptop to play video games. I travel for work and on my down time I love to game. I checked the event log on windows and it seems the laptop over throttles and shuts down to prevent damage. I was looking at the cpu temperatures while in game and the temp was fluctuating from 80 to 100 degrees Celsius within seconds. I’m not sure if this is a hardware issue or software malfunction when reading temps. I called acer and they had me update the BIOS but still shut down. I really love this laptop but I think I have no choice but to return it. I hope they can fix the issue.",Yes
5,Bang for the buck,Great thin and light powerhouse of a laptop. And for the price is an amazing deal,Yes
5,Amazing for gaming,Best laptop I’ve owned. Definitely recommend getting a cooling pad for it. Oled screen with the 5070ti goes hard,Yes
5,Great laptop!,This laptop has been a great purchase! I love how fast it is and the screen images are sharp and clear! I am so glad we purchased this one.,Yes
5,Review,It's a pretty good laptop with a powerful graphic chard with a smoth screen i ever seen,Yes
5,Excelent,"Excelent laptop, fast, powerfull and very good screen",Yes
5,Great,"great mix of budget, performance and portability. Covers all areas realy well",Yes
5,As advertized!,"Beautifl and sleek machine, runs great, does tend to get a bit warm during heavy gaming sessions though.",Yes
4,Fantastic except for 1 thing,"Laptop is great.  Everything loads fast, graphics are superb.  Using copilot with alt-enter is a breeze and the bread and butter of interacting these days.  Only thing that cracked me up laughing, was the audio.  Maybe I was spoiled before with my custom laptop, but the sound coming out of this thing is like a tin can.  Absolutely wretched haha.  Definitely dont get this laptop unless you already have some good headphones, or external speakers.",Yes
4,Miss control key on right side,"Great product, it's better than I expected, the games run well and without lowering the quality, very fast and efficient. The only bad thing is that where it should have the control key on the right side, it has an AI button and in my case I need that key as a control, it's very difficult for me to press the left control.",Yes
3,Is really amazing laptop but,"Specs insane, performance really good but something happen sometimes im trying to fix it but i cant, sometimes the picture frozen and you can hear everything working except for the picture frozen the only way to fix is hold the power and shut off and restart….  I was trying to play world of warcraft just world of warcraft nothing AAA, before this laptop im using zephyros  16” version 2022 I bought from best buy too.  Im trying to exchange for another one but the store no have more here only the money back and my store start burning  that is really sad. Rainbow arroyo.",Yes
5,The best laptop !,"I see a lot of people worrying about benchmarks and trying to choose the best purchase, but I can tell you with confidence this is the best you can buy for the price. Its screen is incredible! I had never had an OLED other than on cell phones, and it’s so amazing that I’m even thinking about getting an OLED monitor as well. As for Best Buy’s service, it was top-notch when I bought it! I totally recommend it.",Yes
5,This Acer Predator is a beast!,"I recently purchased this laptop as I needed something under a certain price but with a higher end 50xx series Nvidia for video editing and gaming. I am very happy with my purchase as this Acer Predator is fast to boot up, has a nice RGB keyboard, works well with Adobe and Topaz apps and fits all my gaming needs. 

I keep it plugged in because it would drain too fast for what I do but I am always near a socket so it isn't an issue for me.",Yes
5,Amazing laptop,Amazing laptop for the price. 5070ti delivers. Only upgrade needed is the ssd. The only thing I dislike is the speakers. But other than that the laptop is amazing and I love the backlight on the cover. This is by far my favorite laptop I’ve owned.,Yes
5,The Price is Right!,"At the time of writing, this laptop easily beats other laptops with similar specs on price-point. If it ever goes on sale, it will be a steal. Almost all other 5070 TI laptops are well over $2K with only 16gb of RAM! This one has 32gb and a Core Ultra 9 Series 2 processor at sub $2K price. The OLED panel is beautiful with its inky blacks at 240hz. Buy while it's available.",Yes
5,Nothing comes close at the price!,"Nothing else comes close for the price. Intel Ultra 9 + 507ti, 2 Ram slots. 2 NVME slots. 240Hz OLED display. Well worth the purchase.",Yes
5,Professional power in a laptop,"This laptop has been well able to run architecture software such as Revit, for example,  but is still portable without sacrificing too much screen size and processing power.  It accomodates extra screens with the wealth of ports included.",Yes
5,Working better than expected,"After using it for a week i been loving it, the computer will work with either the cpu or the gpu graphics to manage more battery and when you need more performance it will change in between, so far its been great for all ive thrown to it",Yes
4,Mobile gaming,Works great for what i need which is gaming well out of town on work trips,Yes
4,Best out there for the money!!!,"1st off the speakers are not that bad if you get Dolby Atmos and tune then properly...The fans are only loud under intense gaming ""Performance mode"" which earphones would mostly be used. My only minor gripes would be the glossy screen and no choices on what HZ to run the screen at?",Yes
5,Great Laptop!,"I had a 9-year-old MSI laptop that I needed to replace because Windows was no longer supported. Over time, it had become so slow that it was frustrating to use. My goal was to find an affordable yet powerful laptop to take its place.
After talking with some of my coworkers who are front-end developers, the decision was easy—I went with this one. You simply can’t get these specs for this price from any other brand.
So far, it’s incredibly fast, and multitasking is a breeze. The screen isn’t matte, but the graphics are stunning.
If you’re on the fence, just buy it!",Yes
5,Solid,This was a solid buy. There was another review that said the noise when starting up was annoying. There is a way to remove that sound. You may want to because it is a bit loud.,Yes
5,One of the Best Gaming Laptop,Fast and reliable. Not going to lie the battery does die fast while gaming. So keep it plugged,Yes
5,Great production. quality price amazing,"great, nothing to say about it. the screen its amazing, great contrast and with the fan at maximum you nca play bf6 without have the laptop become a BBQ",Yes
4,Great specs for under 2k,Excellent laptop for price and easy to upgrade SSD (if you have a Torx screwdriver and pry tool) but heats up quickly and does not have any option to set the fan curve.,Yes
5,Fast and bright,"Fast, great screen, stays cool. Works perfectly for complex music production. Will also be doing video production. The Nvidi card should be great for that.",Yes
5,Acer laptop,"For $1700 (sale at the time), im enjoying it. Yes, the audio sucks and the fans are a little loud. You're probably going to wear heaphones to game anyways either at home or wherever. Everything else about this laptop checks all my boxes.",Yes
5,Love it,Great value. High framrates on the games I play. Works best in performance or Turbo mode because that allows the cooling fans to run at higher speeds. Full keyboard is great for software development and processor compiles my code in no time.,Yes
5,Acer - Predator Helios Neo 16S AI Gaming Laptop,Great laptop. Son is delighted. Plays his favorite games at maximum settings. And it seems this is not the limit. We use a month flight normal.,Yes
5,would recommend,"Great laptop, amazing specs, works really fast. the only drawback is the speaker",Yes
5,Great choices,"Great productivity for very reasonable price!
The screen is outstanding!
Like a ports architecture!",Yes
5,Bang for buck,"Absolute bang for buck, only issue is that you cannot lower down the refresh rate on this computer and the battery life sucks so e reviews say it can only last you for 3 hrs max but for me it only last 2 at the very best conditions still really good though",Yes
5,Best value for your money,"I was in the market for a gaming laptop for some time, and this one gave me everything I wanted for the price I wanted to pay.",Yes
2,Not built to last,"Upon powering on and clean installing windows, CPU is consistently sitting idle at 80 degrees with occasional drops to 70 at its lowest. Already sceptical I started Hades maxed out, not a very demanding game. Fans started blasting twenty minutes in and computer completely shut down due to heat. I mean it could be just the one i tried, possible thermal pasting/pipes issue. Or it could be that “too good to be true” still stands true. They obviously cut corners somwhere, and i think i know where.",No
3,Acer helio neos 16s,"It’s a really good computer, talking about , performance, game and screen quality on the laptop. Already exchange the laptop for the same one cause the last one was coming with a processor issue Code 41.  Pretty much the processor/ram was crashing and the computer was Turing off/on every 20 minutes was really annoying. I’m texting this one rright and everything is looking great",Yes
5,Predator,This PC is amazing I don't regret investing my money in it,Yes
5,Vaue for money,"It's a beast laptop, with 240 Hz display. Games run really smooth with no lag.",Yes
5,Bang for your $,"Solid purchase for your money.  The 5070ti, 32 ram, and 1 TB are a solid entry level into current titles.",Yes
5,Great Lapper,So far so good. Runs really well for work related purposes. I haven't had to wait on it for anything.,Yes
5,Great computer excellent price,"So far so good, likely more computer than i need but got it at a great price.",Yes
5,Amazing Labtop for the price,Runs BF 2042 max setttings 1600p ult 140fps it can handle any game you throw wat it max the fan speeds an labtop cooling pad an cpu 78c Gpu 60C well worth the price,Yes
5,No regrets,I am glad I bought it.  Works flawlessly.  It has a beautiful display and is nice and quiet.,Yes
4,Computer Review,"Fast, good quality images. Key board needs time to get used to ergonomically.",Yes
5,My laptop,"It's a very good laptop I'm very happy and I will recommend ,thanks",Yes
5,Great Product,"Excellent product for the price, very pleased with my experience so far other than battery life because screen is stuck at 240 htz and you cant turn it down, otherwise no issues.",Yes
4,Good stuff,Works great i got it for gaming and is better than expected.,No
4,Great machine and sleek,"Great machine, great screen and very fast, any game I okay was running beautifully, I believe the speakers could have been better",Yes
5,Review of Predator Helios Neo,Product works great and the staff at my Best Buy were very nice about helping me work through my problems.,Yes
5,SUPER POWER ACER,super power gaming laptop my top  monitor  OLED 240HZ ROXCKSSSS AND THE RTX 5070TI ITS POWWERFULL I HAVE MADE  I AM SO HAPPY NOW,Yes
5,Computer,Good and nice computer nice price and excellent services,Yes
1,Very disappointed,"I bought this computer less than 2 months ago. Three days after it arrived, it suddenly shut down (like if from overheating). It was quite strange, it is a very powerful gaming laptop, RTX 5070Ti, I was playing Dragon's Dogma 2 and not in ultra quality and always with the fps and temperature on the screen. It shut off with no warnings, no errors, just pump! No lights or anything. I had to unplug the charger to get it working again. The next day I did a little research and updated the BIOS from the official website to the latest version, and no more problems until now, one month after the last problem, playing Red Dead Redemption 2 I just had the same problem as before. A sudden shutdown. This time, I heard the fan go very loud even though temperatures were below 68°C.  The fan becomes very powerful when temperatures are below 68°C. I had to disconnect the charger again in order to restart the PC . Right now, it's a very difficult situation because the return period has already expired and the product is defective. Furthermore, the BIOS is locked.",No
5,Nothing less than a 5 star,"Great product, it works flawlessly as expected. It has a great performance",Yes
5,great laptop,"great laptop, sent to college campus with fast shipping,",Yes
5,Good Gaming Rig,"The lap top is fast and responsive, the fan is a bit loud but overall I am happy with its performance.",Yes
5,Acer Laptop,Works very good for all kinds of work but works especially good for games,Yes
5,Nice laptop,"Great laptop, nice oled screen. Cant get a better deal on a 5070ti",Yes
5,Acer predator,"Great performance and cost.
Window11 suck by the way.
GPU switch may cause delay and screen black a little bit.",Yes
5,Very good laptop.,"Amazing laptop, the screen colors are brilliant and the speed is very fast. I love it. This laptop will be with me for a long time.",Yes
5,PERFECT,"PErfect gaming laptop for below 2000, has everything you need.",Yes
5,Great laptop! Awesome at running games!,"Performance is awesome for games when connected to charger, I knew that when I made the purchase so it’s been exceeding all expectation!",Yes
5,Best value for a powerful laptop,"Needed something for travel that was powerful and compact,this checks all boxes.",Yes
5,Laptop,"Best laptop ever i have buying into my life, i will recommend everyone that model and also best way payments",Yes
3,Reboots randomly under the load.,"Overall good, but in case of any load rebooted randomly a few times a day. Ended returning it and chose different laptop.
Battery life is very short, which you should expect from gaming laptop, but new laptop I got instead of this one holds battery at least twice as long",No
3,Great when it works. Shuts down at least weekly,"Beautiful looking computer and feels solid.  However, it shuts down randomly (on a weekly basis) with the blue screen error ""Your PC ran into a problem and needs to restart"" - normally there will be a code at the very bottom from what I see online- but there is no stop code shown.  Drivers and all software/hardware is up to date.  
One other issue I have is the ""Co-Pilot"" button placement.    It took the space of the Ctrl button that I used frequently. (Not the left Ctrl button)   Would be great if they placed it somewhere else.",No
5,Great!!!,"Does the job for gaming for WOW & Call of duty, and normal use and work",Yes
5,Good laptop,"Exceptionally good screen, runs any game, would recommend",Yes
1,Last time purchasing a Predator Laptop,"I ended up returning this laptop after less than a week of purchase as the screen was stuttering heavily on even basic games, the fans ran loud, and it was overheating constantly.",No
5,Great Acer.,"Very fast, excellent screen, games run great abd look great. Perfect machine.",Yes
5,Excellent quality,"Love the laptop, its everything and more! Its lightweight",Yes
5,Review,Quick response when downloading; fast response to searches on internet and internet sites; speed; color is fantastic;,Yes
4,Review,"It is a good system, but the AI is a little jumpy.  Cuts in and out however it really helped when I had to send an important letter",Yes
4,"Good Buy, expect it to last a long time","Great view and easy to set up.  The keyboard layout is a little non standard, so that takes some getting use to.",Yes
5,Work Great!,No issues so far. I bought this about a month ago and it can handel all of my PC games i have been wantung to play. A great computer for a furst time gamer and a lot cheaper than some other options out there.,Yes
