rating,headline,text,would_recommend
5,Title,Good laptop heats up fast tho. Specs are very nice,Yes
1,"Not great, even for the low price. Don’t buy.","Besides from the abysmal battery life, overclocking and undervolting lock, and terrible speakers, Acer had driver issues as well. Opening Steam would probably give an epilepsy for some, specifically on a game page or your friends list. Very low power 5070ti, you might as well get a 5070 and overclock it if you are okay with missing out of 4g VRAM. Additionally, in the first week of purchase, i got 2 BSODs and many, MANY stuttering errors.

I don’t have the product video (it was on the laptop), but I do have a video of the Steam situation here:

https://www.reddit.com/r/GamingLaptops/comments/1n8uxhp/moving_away_from_acer/",No
5,Buy Yes,Gooooooooooooooooooooooooooooooooooooooooooooooooood,Yes
5,Great experience,Gavin was extremely helpful and did a great job assisting me and my son purchasing a laptop. Phenomenal associate!,Yes
1,Very Disappointed with Delivery Experience,"I purchased the Acer Helios Neo 16S laptop for nearly $1,800 along with Best Buy’s Total Premium Membership (another $180), which promises 2-day delivery. I placed my order on September 4, and the system showed a delivery date of September 8. I stayed home the entire day, rearranging my schedule to receive the package, but it never arrived.

For such a high-value purchase, this experience has been extremely frustrating. The product itself may be great, but Best Buy needs to deliver on its promises — especially when customers pay extra for premium services. I expected reliability, and instead I feel let down.",No
5,Best for the value,"Best for the Value, and the way we could price match is the best thing.",Yes
4,Not too too bad,"Its about average………………………………………………………..
…………………….",Yes
5,For Gaming,The laptop is amazing it hasnt given me any problems wit atleast 3 months of moderate use it is reliable and i can run any game i want at good settings.,Yes
5,He's just gorgeous.,There are no disadvantages. I have been using it for more than a month and have not found anything bad. It works very quietly.,Yes
5,"Predator ""Rocketship""","The Laptop is daBomb!
Fast with a lot of Stamina and Storage",Yes
5,Best price & performance,"If you want to buy gaming laptop with price & performance, exactly you need to choose this one.",Yes
5,Best for price,Very good for price and spec it has. With the specs is the best price will find.,Yes
3,price to performance but cheerful about defective,Thermal and performance is not up to the mark. Good for gpu intensive work at this price range. Mine getting crashed while playing even videos even after driver updates if work in battery,No
3,It was okay,"The laptop is decent, running games like call of duty was laggy.",No
5,The laptop is better than other for the price,Excellent for this price. Temperature GPU is 50-70*C,Yes
5,Amazon screen,Looks amazing runs at good temps not to hot worth the money should last 4years,Yes
1,poor quality,"this was my first Acer Predator gaming laptop. I buy new laptop with every nvidia series drop and this looked like a great value at the begining and i bought it. After some time of use i relalised how poor the material quality is. Even while im typing this comment it is glitching and freezing time to time. when you game on this laptop it freezez hen you put your hand on wasd side. switches between integrated and gaming vga is another freeze session. I dont recommend this. I would never buy anything other than Asus ROG, other asus series are bad choice as well",No
1,Recall and Fire Hazard,"Potential fire hazard. I burned my hand and almost burned my backpack. It got too hot, and I could smell the burn. It's not possible to travel with it. If you carry it in your backpack with all the apps closed and in sleep mode, expect a burn. I tried everything, but nothing seems to work. I don't think replacing the motherboard will solve it. I may have to report it to Safety Commissions due to potential fire hazard. I cannot travel with this laptop anywhere due to a fear of it burning.",No
1,Would Not Recommend.,"Had issues from the first boot.  Would restart randomly whether just starting up, browsing the internet or playing a game. Got very, very hot while playing a mid tier game or higher.  Screen would also flicker at any given time. I updated all the drivers and BIOS, should not be happening. When returning I was told someone came in earlier that day with the exact same issues.  Would Not Recommend, swapped for a Lenovo.",No
4,"Good Price to Performance , 115w MGP","Reviews seem to be limited at the time of writing. This laptop provides great price to performance. But there is a reason its 1899.99.. this laptop form facter is different. While thin, the cooling vents make it have a larger surface area than you may think. This makes accessories and backpack fitment more challenging. The build quality is nice though. The 275HX CPU in this form factor is a monster if you need cores, the H series chips in similar formfactors get annihilated. The 5070 ti is fantastic for games and data science.  The memory is upgradeable which is a huge plus for those that need 64 or 96Gb. The screen is beautiful but glossy and may not be bright enough for viewing in brighter environments. Two M.2 storage slots. Ports are adequate for this price. The cooler and fans actually arent that bad and do a pretty good job. The power brick is very manageable in size. I think its 230W? Keyboard is good, but the trackpad has too much texure in my opinion which causes to much friction. I used this laptop for a few days but some things i just couldn't get over. One, the speakers are horrendous. The two speakers only cover mids and you have to play with the equalizer to get them somewhat acceptable. If you dont always wear headphones, this might really disappoint you. Secondly, the software is straight up bad. I dont understand why these big companies can't make a basic interface like the community made gHelper for asus. Acer locks down the CPU so undervolting is currently impossible via software. The Nvidia 5070 ti is great, but it's capped at 115w max graphics power or MGP.. that 115 includes the dynamic boost. You are absolutely buying a power limited 5070 ti and it shows. Maybe a 10-15% difference than full power 5070 ti laptops. It does do great in my opnion for the form factor though. If the software suite was just simple and the speakers were increased to 4 from a measly 2 and half decent, I may have kept it. It was so close!",No
3,Computer is shutting down randomly,For some weird reason the computer shuts down randomly.. gonna take it back and see what’s up,No
2,Disappointed,"The laptop froze a few times while running games, nvidia optimus setting causes glitches, and nvidia graphics optimizing also causes glitches in all the games. Specs are amazing for the price but unfortunately it is not a keeper",No
5,Holy grail of value,"In this overpriced market this unit really shines. Awesome specs for such a price, at least compared to the other options. Build quality is totally decent all around and the bottom is aluminum as is the back of the display. The display itself is gorgeous, really nice colors, it's a pleasant viewing experience. Plenty bright. It stays cool, and the fans dont get particularly loud unless you're really pushing the limits. The Core Ultra 9 is incredibly snappy and quick with whatever I throw at it, and the 5070ti has plenty of processing power and memory to work with the 2.5k display.",Yes
2,Mirror glossy screen ruins great laptop,This is an amazing rig except they ruined it with that glossy screen that is like a mirror.,No
1,Defective out of the box.,Was defective out of the box. Kept going into an unending reboot loop. I live over 6 hours from the nearest Best Buy so I had to ship it back to have it returned. Still waiting on a refund. I plan to get another one once my refund is issued. I'll update this review if it ends up being a fluke.,No
1,Not what was expected at all,Couldn't run basic adobe programs from the first week. Ran very hot. Traded in 2nd week for a competing brand.,No
1,overheats easily,Less than a month old and already having to take it back overheating,No
1,Slow processing,The laptop has a hard time processing even the smallest stuff in adobe after effects.,No
1,Bad labtop,Powers stop working.                   ............,No
5,A steal for the price point.,"Picked up this gem at Best Buy today. I initially went in to purchase a different gaming laptop at almost a similar price point. Upon looking at their inventory through the app when I was there, i noticed this laptop was available but not out for display. I asked the customer service rep about it and they werent even aware that they had it in stock themselves. So he was shocked. Looked it over and youre getting some amazing value here. OLED screen, which by the way, looks gorgeous. 16"" screen, 240hz display, 32 freaking gigs of ram and 1TB SSD. This was a winner. Opened it up at home, installer some games to test drive and all work flawlessly. The games were Warzone, Elden Ring, Red Dead Redemption, League of Legends, and WoW, all which were on MAX settings. It did get a bit hot at first but after running all the windows updates, it cooled off. It has all the ports you will need including an ethernet port for all you hardwired freaks like me. 3 USB connections, HDMI, and well pretty much everything youll need to rock and roll. Only time will tell of how long the quality of this product will last since Im not familiar with Acer as much (I have a Lenovo Legion desktop) but it seems like a well built product and definitely feels premium. I have the total gech protection for 2 years so im not too worried. Overall, a fine purchase!",Yes
5,Amazing!,"Very happy that I went with this laptop. The screen is amazing and the thermals seem to be pretty good. I pushed the system pretty hard and the GPU stayed in the low 80s and the CPU in the low 90s. Also, the advertised screen refresh rate here on Best Buy (165hz) is not correct. The screen is actually 240hz, which was a pleseant surprise. I was a bit worried buying this as it is a slim variant (less GPU wattage) and there arent many major reviews out. Ran some benchmarks and it only came 7-8% less than the average 5070ti laptop. The only downside to this laptop is that the speakers seem to be pretty low quality, but thats not a big deal to me.",Yes
5,The Best Laptop I’ve Never Touched,"Wow — the Acer Predator Helios Neo 16S AI is incredible! At least, I assume it is. It’s been months since I ordered it, and while it hasn’t actually arrived, just thinking about those specs gives me a warm fuzzy feeling inside.

I mean, who wouldn’t be excited about a 16” OLED 165Hz screen, Intel Core Ultra 9, RTX 5070Ti, 32GB of RAM, and a full terabyte of storage? It’s basically a spaceship disguised as a laptop. Too bad it’s still on its intergalactic journey to my doorstep.

But hey, patience builds character, right? At this rate, by the time it shows up, there might be a Predator Helios Neo 17 with AI that makes coffee — but I’ll cherish this mythical beast all the same.

Highly recommend… if you’re into long-term relationships with tracking numbers.",Yes
5,"Great Value, Little Comprimise","I almost slept on this because of the Acer brand (always saw Acer as a lower end brand). However, the screen on this laptop really is beautiful. I had a 14” Zephyrus, and that thing got hot. This is able to get way more fps and does an amazing job handling the heat. 2 cons really: 1) i noticed the system can get bogged down and unresponsive sometimes. Not sure if this is Windows related or hardeare related. 2) im not an audiohile, but the soeakers are ok. I had to turn off Spatial sound so that i could actually hear the games. Overall, really great value! (Also came with a neoprene laptop sleeve, nice surprise!)",Yes
4,Great laptop especially for architecture,I have 2 months with the computer and at the moment it is in perfect conditions.,Yes
5,The best,"The best, poor sound and batery life, but is like McQueen . Xd",Yes
5,Happy customer,Best laptop I have seen for this price $1899 for a rtx5070ti OLED 240hz is by far the best deal,Yes
5,When will this be available,"When is this expected to become available, weve all been patiently waiting",Yes
5,When will it be available,When will it drop and why it says sold out i don't get it,Yes
2,Unsure of this yet.,"Very nice laptop when it is not crashing on me. Also very concerned with how hot it runs (90-100 F), but support says that is normal. I wish I had confidence in this purchase, but unfortunately I do not. Trying to see what support can do before I return it because I am afraid this will not last",No
1,Junk,"This laptop had the best proce to specs ratio. The predatorsense software doesnt work when it comes to updating. I went to manually update things and the website doesnt explain anything at all. It still doesnt update. Lastly, this is not 165hz its 240hz. Which should be good right?? Wrong, the screennis locked at 240hz. I tried absolutely everything. Ddu gpu drivers. Fresh insall. And went through all the recommended steps with Acer support. Nothing works. A laptop needs to be at a lower refresh rate when unplugged. It eats through battery life crazy fast at 240hz. Will be returning this.",No
5,HIGHLY RECOMMEND!!,Runs great and smooth! I love how the keyboard goes into a rainbow light show when it turns on or you press a key,Yes
5,Sweet Dreams,"Every day I wake up and thank the lord for sending me this powerful machine, oh wait, that’s just my pillow… maybe tomorrow I’ll have this delivered to my door.",Yes
5,Release date please?,Release date please?  We are egerly waiting for it.,Yes
